{
  "schema_version": "2.0-rc1",
  "issue_id": "SP-vision-multimodal-2026",
  "research_profile": "THEMATIC",
  "basis": {
    "production_profile_sha256": "e4d16027d66d379848378031e47198a09f0b27a961e27a0ab250923a07a57444",
    "materiality_ledger_sha256": "4d20abcdd39a3ab4bda1d0d0e88d633fa8ff985e571af3650b61515361341e83"
  },
  "overall_status": "LIMITED",
  "obligations": [
    {
      "obligation_id": "VM-O01",
      "dimension": "learned_visual_representation",
      "description": "D01 MANDATORY/CONTEXT_CAPPED: 学習済み再利用可能表現・大規模教師あり・transferの確立。Neocognitron/LeNet context、AlexNet、ResNet。X01: ImageNet-scale教師あり契約。X02: class-label入出力契約。",
      "status": "SATISFIED",
      "discovery_ids": [
        "VM-D001",
        "VM-D002",
        "VM-D003",
        "VM-D004"
      ],
      "evidence_task_ids": [
        "evidence:SP-vision-multimodal-2026:25ffb37e8ae8213c",
        "evidence:SP-vision-multimodal-2026:380dc979ab3f132d",
        "evidence:SP-vision-multimodal-2026:649b3797fd83a762",
        "evidence:SP-vision-multimodal-2026:8d13b894941b9513"
      ],
      "rationale": "Context-capped scope met: Neocognitron/LeNet predecessor context + AlexNet/ResNet anchors with mechanism, bottleneck and transfer detail. LeNet PDF encoding barrier and Neocognitron paywall do not block the context-level claim. No pre-deep CV expansion."
    },
    {
      "obligation_id": "VM-O02",
      "dimension": "detection_structured_localization",
      "description": "D02 MANDATORY: 分類からidentity+locationへ。R-CNN系/Faster R-CNN、YOLO系/SSD/RetinaNet operating point、DETR set prediction、DINO detector (self-supervised DINOと区別)、YOLO-World等OV橋。X02: box入出力契約。",
      "status": "SATISFIED",
      "discovery_ids": [
        "VM-D005",
        "VM-D006",
        "VM-D007",
        "VM-D008",
        "VM-D009",
        "VM-D010",
        "VM-D011",
        "VM-D012"
      ],
      "evidence_task_ids": [
        "evidence:SP-vision-multimodal-2026:1619d326d81a5223",
        "evidence:SP-vision-multimodal-2026:2ca2b01d89b9f6f3",
        "evidence:SP-vision-multimodal-2026:392343dab0a3215c",
        "evidence:SP-vision-multimodal-2026:b10c9e111b6ab1e8",
        "evidence:SP-vision-multimodal-2026:b7de06e9d5276cc1",
        "evidence:SP-vision-multimodal-2026:bfd74d856a35f1c7",
        "evidence:SP-vision-multimodal-2026:c8c632d0be6a2fc6",
        "evidence:SP-vision-multimodal-2026:f63075086ce1c194"
      ],
      "rationale": "Region/two-stage, one-stage operating points, DETR set-prediction transition and OV bridge all bound with mechanism detail; DINO detector/ss disambiguated. OWOD remains a D07B footnote by design."
    },
    {
      "obligation_id": "VM-O03",
      "dimension": "dense_perception_segmentation",
      "description": "D03 MANDATORY: boxからdense構造へ。FCN、U-Net (segmentation役割のみ)、Mask R-CNN、panoptic、SAM/SAM2 promptable系。X02: mask入出力契約。",
      "status": "SATISFIED",
      "discovery_ids": [
        "VM-D013",
        "VM-D014",
        "VM-D015",
        "VM-D016",
        "VM-D017",
        "VM-D018"
      ],
      "evidence_task_ids": [
        "evidence:SP-vision-multimodal-2026:07b5808887ca079e",
        "evidence:SP-vision-multimodal-2026:231a944a9fd799b8",
        "evidence:SP-vision-multimodal-2026:430f58620318dee9",
        "evidence:SP-vision-multimodal-2026:4c4e58ac13a1d141",
        "evidence:SP-vision-multimodal-2026:7407b38e6e4d1286",
        "evidence:SP-vision-multimodal-2026:e64042250de2535e"
      ],
      "rationale": "Dense/instance/panoptic/promptable distinctions bound; SAM dual reading and SAM 2 video bridge recorded. U-Net confined to segmentation role (TS-002 boundary intact)."
    },
    {
      "obligation_id": "VM-O04",
      "dimension": "spatial_geometry_substrate",
      "description": "D04 MANDATORY_SUPPORT/HARD_CAP: 4-node allow-list (MiDaS/OpenPose/Visual Genome/DUSt3R)。labelにない空間state、後段が仮定する2D/2.5D/3D state、token化時の得失。同等契約の置換のみ許容、拡大禁止。",
      "status": "SATISFIED",
      "discovery_ids": [
        "VM-D019",
        "VM-D020",
        "VM-D021",
        "VM-D022"
      ],
      "evidence_task_ids": [
        "evidence:SP-vision-multimodal-2026:85bc25df6171e3dd",
        "evidence:SP-vision-multimodal-2026:a6b4065d7ddd17fd",
        "evidence:SP-vision-multimodal-2026:ab41a7643858ee00",
        "evidence:SP-vision-multimodal-2026:ad9033f18ee4f668"
      ],
      "rationale": "Four-node support cap met exactly (MiDaS/OpenPose/Visual Genome/DUSt3R) with stated limits; support-substrate purpose fulfilled; refusals (NeRF/3DGS/SLAM/MVS) ledgered, not silently omitted."
    },
    {
      "obligation_id": "VM-O05",
      "dimension": "ocr_document_intelligence",
      "description": "D05 MANDATORY/NORMAL_WEIGHT: glyphからlayout/symbolicへ。LayoutLM系/Donut/Pix2Struct、specialist (Nougat/GOT) vs general VLM (default NO_CROSS_MODEL_NUMERIC_COMPARISON、5軸qualitative契約)、retrieval bounded sub-lane。X01: document/markup教師契約。",
      "status": "SATISFIED",
      "discovery_ids": [
        "VM-D023",
        "VM-D024",
        "VM-D025",
        "VM-D026",
        "VM-D027",
        "VM-D028",
        "VM-D029",
        "VM-D108",
        "VM-D109",
        "VM-D110"
      ],
      "evidence_task_ids": [
        "evidence:SP-vision-multimodal-2026:18525095708ea29a",
        "evidence:SP-vision-multimodal-2026:4ca2413b8167abe8",
        "evidence:SP-vision-multimodal-2026:5991ba15eeeb4c53",
        "evidence:SP-vision-multimodal-2026:70a2a554e22606a9",
        "evidence:SP-vision-multimodal-2026:7224dfc5069331e2",
        "evidence:SP-vision-multimodal-2026:a3d0f0452d7e3282",
        "evidence:SP-vision-multimodal-2026:aa38689cb7a40158",
        "evidence:SP-vision-multimodal-2026:ca420082868a82a9",
        "evidence:SP-vision-multimodal-2026:ece87f85960ba2b4",
        "evidence:SP-vision-multimodal-2026:f1346f195b48d6e0"
      ],
      "rationale": "LayoutLM lineage, OCR-free branch, Nougat/GOT specialist poles with failure profiles, Pix2Struct UI bridge and retrieval sub-lane all bound. Specialist-vs-generalist comparison stands on the qualitative five-axis contract; numeric ranking prohibited by contract (G03 concerns same-protocol head-to-head absence, not a coverage deficit)."
    },
    {
      "obligation_id": "VM-O06",
      "dimension": "vit_selfsupervised_foundation",
      "description": "D06 MANDATORY: patch/token formulationとlabel-free再利用表現。ViT/DeiT/Swin、MAE/DINO/DINOv2、SigLIPと後段encoder reuse。X01: self-supervised/masked/distillation目的契約。",
      "status": "SATISFIED",
      "discovery_ids": [
        "VM-D030",
        "VM-D031",
        "VM-D032",
        "VM-D033",
        "VM-D034",
        "VM-D035",
        "VM-D036"
      ],
      "evidence_task_ids": [
        "evidence:SP-vision-multimodal-2026:0eb3420fb03f017e",
        "evidence:SP-vision-multimodal-2026:35ac530167b1aead",
        "evidence:SP-vision-multimodal-2026:3c9024041edb1a4a",
        "evidence:SP-vision-multimodal-2026:4e994d899261cc65",
        "evidence:SP-vision-multimodal-2026:654257bfd25b2055",
        "evidence:SP-vision-multimodal-2026:9dce7c29b30f2b61",
        "evidence:SP-vision-multimodal-2026:fea277ab42f86a90"
      ],
      "rationale": "Token-formulation and label-free representation lineage complete (ViT/DeiT/Swin/MAE/DINO/DINOv2) and encoder reuse into Qwen established with exact citation binding now specified: SigLIP2-So400m initialization and dynamic-resolution continual training per Qwen3-VL report Vision Encoder section and Qwen3-Omni report section 2.3/Table 1 (read-only verified 2026-10-03; reuse fact in D065 claim-2)."
    },
    {
      "obligation_id": "VM-O07",
      "dimension": "image_level_vl_alignment",
      "description": "D07A MANDATORY/FULL_WEIGHT: 固定ontologyから言語addressable意味へ。DeViSE/captioning/VQA predecessor、CLIP/ALIGN/SigLIP。評価はzero-shot分類・retrieval (D07B指標と統合禁止)。X01: image-text pair教師契約。X02: text<->image入出力契約。",
      "status": "SATISFIED",
      "discovery_ids": [
        "VM-D036",
        "VM-D037",
        "VM-D038",
        "VM-D039",
        "VM-D040"
      ],
      "evidence_task_ids": [
        "evidence:SP-vision-multimodal-2026:000811ab2cedb843",
        "evidence:SP-vision-multimodal-2026:0eb3420fb03f017e",
        "evidence:SP-vision-multimodal-2026:20d1ebc2759ddd61",
        "evidence:SP-vision-multimodal-2026:25a1e7517b74ec98",
        "evidence:SP-vision-multimodal-2026:caa9b1c0fdfb5b31"
      ],
      "rationale": "Captioning/VQA predecessors, CLIP addressability break with preserved bag-of-words limitation, and ALIGN/SigLIP variants bound; image-level metric identity never merged with grounding metrics."
    },
    {
      "obligation_id": "VM-O08",
      "dimension": "openvocab_perception_grounding",
      "description": "D07B MANDATORY/FULL_WEIGHT: 言語概念からbox/mask/coordinate/evidenceへ。Flickr30k/RefCOCO/OVR-CNN/ViLD/RegionCLIP/Detic/GLIP/MDETR/OWL-ViT/Grounding DINO/OWL-ST/LSeg->X-Decoder (OpenSeg/ODISE bounded variant)。CLIP+Grounding DINOへの圧縮禁止。評価はLVIS-rare/ODinW/RefCOCO/phrase Recall@K。X01: caption/grounding/pseudo-label教師契約。",
      "status": "SATISFIED",
      "discovery_ids": [
        "VM-D011",
        "VM-D012",
        "VM-D021",
        "VM-D041",
        "VM-D042",
        "VM-D043",
        "VM-D044",
        "VM-D045",
        "VM-D046",
        "VM-D047",
        "VM-D048",
        "VM-D049",
        "VM-D050",
        "VM-D051",
        "VM-D052",
        "VM-D053",
        "VM-D054",
        "VM-D055",
        "VM-D056"
      ],
      "evidence_task_ids": [
        "evidence:SP-vision-multimodal-2026:121e1a6de76dea8d",
        "evidence:SP-vision-multimodal-2026:139481c043a93d8c",
        "evidence:SP-vision-multimodal-2026:1619d326d81a5223",
        "evidence:SP-vision-multimodal-2026:2cf1e589a946b028",
        "evidence:SP-vision-multimodal-2026:46a40e71f36174e1",
        "evidence:SP-vision-multimodal-2026:48b74d1180cca336",
        "evidence:SP-vision-multimodal-2026:48beece23bd3412f",
        "evidence:SP-vision-multimodal-2026:81a7c66884ebcdef",